Cites,Authors,Title,Year,Source,Publisher,ArticleURL,CitesURL,GSRank,QueryDate,Type,DOI,ISSN,CitationURL,Volume,Issue,StartPage,EndPage,ECC,CitesPerYear,CitesPerAuthor,AuthorCount,Age,Abstract,FullTextURL,RelatedURL
,"Zhu, Jie; Xun, Peng-Cheng; Kolencik, Marissa; Yang, Ke-Feng; Fly, Alyce D.; Kahe, Ka",Do B Vitamins Enhance the Effect of Omega-3 Polyunsaturated Fatty Acids on Cardiovascular Diseases? A Systematic Review of Clinical Trials,2022,Nutrients,,https://www.mdpi.com/2072-6643/14/8/1608,,,,,10.3390/nu14081608,,,,,,,,,,,,,,
,"McAllister, Matthew J.; Gonzalez, Drew E.; Leonard, Megan; Martaindale, M. Hunter; Bloomer, Richard J.; Pence, Jacquelyn; Martin, Steven E.",Risk Factors for Cardiometabolic Disease in Professional Firefighters,2023,Journal of Occupational & Environmental Medicine,,https://journals.lww.com/10.1097/JOM.0000000000002743,,,,,10.1097/JOM.0000000000002743,,,,,,,,,,,,,,
,"Ishola, Adenrele A.; Valles, Damian",Enhancing Safety and Efficiency in Firefighting Operations via Deep Learning and Temperature Forecasting Modeling in Autonomous Unit,2023,Sensors,,https://www.mdpi.com/1424-8220/23/10/4628,,,,,10.3390/s23104628,,,,,,,,,,,,,,
,"Zhu, Jie; Chen, Cheng; Lu, Liping; Shikany, James M.; D’Alton, Mary E.; Kahe, Ka","Folate, Vitamin B <sub>6</sub> , and Vitamin B <sub>12</sub> Status in Association With Metabolic Syndrome Incidence",2023,JAMA Network Open,,https://jamanetwork.com/journals/jamanetworkopen/fullarticle/2800209,,,,,10.1001/jamanetworkopen.2022.50621,,,,,,,,,,,,,,
,"Schepis, Ty S.; Rogers, Andrew H.; Munoz, Liliana; Zvolensky, Michael J.",Indirect effects of emotion regulation in the relationship between pain and cannabis use in adults 18–64 years,2024,Addictive Behaviors,,https://linkinghub.elsevier.com/retrieve/pii/S0306460324000327,,,,,10.1016/j.addbeh.2024.107983,,,,,,,,,,,,,,
,"McAllister, Matthew J.; Gonzalez, Drew E.; Leonard, Megan; Martaindale, M. Hunter; Bloomer, Richard J.; Pence, Jacquelyn; Martin, Steven E.",Firefighters With Higher Cardiorespiratory Fitness Demonstrate Lower Markers of Cardiovascular Disease Risk,2022,Journal of Occupational & Environmental Medicine,,https://journals.lww.com/10.1097/JOM.0000000000002632,,,,,10.1097/JOM.0000000000002632,,,,,,,,,,,,,,
,"Engstrom, Curtiss W.; West, Brady T.; Schepis, Ty S.; McCabe, Sean Esteban",Does the approach used to measure sexual identity affect estimates of health disparities differently by race? A randomized experiment from the National Survey of Family Growth,2024,Social Science & Medicine,,https://linkinghub.elsevier.com/retrieve/pii/S0277953624003319,,,,,10.1016/j.socscimed.2024.116887,,,,,,,,,,,,,,
